[
  {"id": "permission.sales.optchat", "area": "authorization", "description": "Sales允许OptChat", "target": "authorization.check", "input": {"role": "sales", "capability": "optchat"}, "expect": {"equals": {"allowed": true}}},
  {"id": "permission.sales.optdesk", "area": "authorization", "description": "Sales拒绝OptDesk", "target": "authorization.check", "input": {"role": "sales", "capability": "optdesk"}, "expect": {"equals": {"allowed": false}}},
  {"id": "permission.sales.card", "area": "authorization", "description": "Sales允许简版Card", "target": "authorization.check", "input": {"role": "sales", "capability": "report.card.request"}, "expect": {"equals": {"allowed": true}}},
  {"id": "permission.sales.full-report", "area": "authorization", "description": "Sales拒绝完整版Report", "target": "authorization.check", "input": {"role": "sales", "capability": "report.full.request"}, "expect": {"equals": {"allowed": false}}},
  {"id": "permission.sales.module-run", "area": "authorization", "description": "Sales拒绝模块运行", "target": "authorization.check", "input": {"role": "sales", "capability": "module.run"}, "expect": {"equals": {"allowed": false}}},
  {"id": "permission.admin.optdesk", "area": "authorization", "description": "Admin允许OptDesk", "target": "authorization.check", "input": {"role": "admin", "capability": "optdesk"}, "expect": {"equals": {"allowed": true}}},
  {"id": "permission.admin.module-run", "area": "authorization", "description": "Admin允许模块运行", "target": "authorization.check", "input": {"role": "admin", "capability": "module.run"}, "expect": {"equals": {"allowed": true}}},
  {"id": "permission.admin.full-report", "area": "authorization", "description": "Admin允许完整版Report", "target": "authorization.check", "input": {"role": "admin", "capability": "report.full.request"}, "expect": {"equals": {"allowed": true}}}
  ,
  {"id": "permission.store.cross-tenant", "area": "authorization", "description": "本机Store拒绝跨租户读取DataAssetRef", "target": "store.cross_tenant", "input": {}, "expect": {"equals": {"exception.type": "PermissionError"}}}
]
