[
  {
    "id": "reporter.selection.host-projection",
    "area": "reporter",
    "description": "Reporter只从Host选择端口重建task、ModuleRunRef和source_refs",
    "target": "reporter.selection_protocol",
    "input": {"scenario": "valid"},
    "expect": {"equals": {"task_id": "eval-task", "pricing_run_id": "eval-pricing", "html_report_layout": "continuous", "contains_physical_path": false}, "contains": {"selected_modules": "pricing"}}
  },
  {
    "id": "reporter.selection.browser-source-refs-rejected",
    "area": "reporter",
    "description": "浏览器不得提交source_refs或物理结果路径绕过ResultSelectionPort",
    "target": "reporter.selection_protocol",
    "input": {"scenario": "browser_source_refs_rejected"},
    "expect": {"equals": {"exception_type": "ReporterError"}, "contains": {"message": "未知字段"}}
  }
]
