[
  {
    "id": "workflow.catalog.alignment",
    "area": "composition",
    "description": "Knowledger、Payoffer、Pricer和Backtester共用65产品目录",
    "target": "workflow.catalog_alignment",
    "input": {},
    "expect": {"equals": {"aligned": true, "registry_count": 65, "payoffer_count": 65, "pricer_count": 65, "backtester_count": 65}}
  },
  {
    "id": "workflow.knowledge-to-payoff",
    "area": "composition",
    "description": "Knowledger定位结果可直接驱动Payoffer预览",
    "target": "workflow.knowledge_payoff",
    "input": {"product_id": "2.1"},
    "expect": {"equals": {"product_id": "2.1", "name_zh": "看涨期权", "payoff_ok": true}, "contains": {"svg": "<svg"}}
  },
  {
    "id": "workflow.delivery.report",
    "area": "composition",
    "description": "Reporter交付契约与Designer完整HTML报告一致",
    "target": "workflow.delivery_contract",
    "input": {"output_type": "report"},
    "expect": {"equals": {"reporter_supports_output": true, "designer_ok": true, "artifact_output_type": "report", "artifact_format": "html"}}
  },
  {
    "id": "workflow.delivery.card",
    "area": "composition",
    "description": "Reporter交付契约与Designer简版HTML Card一致",
    "target": "workflow.delivery_contract",
    "input": {"output_type": "card"},
    "expect": {"equals": {"reporter_supports_output": true, "designer_ok": true, "artifact_output_type": "card", "artifact_format": "html"}}
  }
]
