[
  {
    "id": "pricer.mc11.low-precision",
    "area": "pricer",
    "description": "MC11可以产出研究结果，但必须标记低精度且不可正式报价",
    "target": "pricer.regression",
    "input": {"scenario": "low_precision"},
    "expect": {"equals": {"status": "priced", "precision_status": "low_precision", "quote_eligible": false, "path_count": 11, "has_precision_gate": true, "calendar.schema_id": "trading-calendar", "calendar.content_hash_matches": true, "calendar.uses_independent_sessions": true}}
  },
  {
    "id": "pricer.observed-state.required",
    "area": "pricer",
    "description": "存续期路径结构缺少ObservedState时不得定价",
    "target": "pricer.regression",
    "input": {"scenario": "observed_state_required"},
    "expect": {"equals": {"status": "unsupported", "precision_status": "not_priced", "quote_eligible": false, "calendar.schema_id": "trading-calendar", "calendar.content_hash_matches": true, "calendar.uses_independent_sessions": true}, "contains": {"messages.0": "必须提供observed_contract_state"}}
  }
]
