[
  {
    "id": "datafetcher.caller-context.force-refresh-denied",
    "area": "datafetcher",
    "description": "普通CallerContext不得声明force_refresh缓存策略",
    "target": "datafetcher.caller_context",
    "input": {"allowed": false},
    "expect": {"equals": {"exception_type": "RequestValidationError"}, "contains": {"message": "CallerContext无force_refresh权限"}}
  },
  {
    "id": "datafetcher.caller-context.force-refresh-allowed",
    "area": "datafetcher",
    "description": "具备显式能力的CallerContext可以通过force_refresh校验",
    "target": "datafetcher.caller_context",
    "input": {"allowed": true},
    "expect": {"equals": {"cache_policy": "force_refresh", "tenant_id": "eval-tenant"}}
  }
]
